{
  "version": 1,
  "upstreamRepo": "ggml-org/llama.cpp",
  "upstreamTag": "b10194",
  "artifacts": [
    {
      "id": "macos-arm64",
      "os": "macos",
      "arch": "arm64",
      "backend": "metal",
      "file": "llama-b10194-bin-macos-arm64.tar.gz",
      "sha256": "03230460822cd2e69bba70488245f9745198d592874f8ca9c96fd0d808d3f866",
      "sizeBytes": 10937078
    },
    {
      "id": "macos-x64",
      "os": "macos",
      "arch": "x64",
      "backend": "metal",
      "file": "llama-b10194-bin-macos-x64.tar.gz",
      "sha256": "2304d44161464310ae11e041e3f40f22873d8875e5f8f31f151ee2e21d38f105",
      "sizeBytes": 11216189
    },
    {
      "id": "win-cpu-x64",
      "os": "windows",
      "arch": "x64",
      "backend": "cpu",
      "file": "llama-b10194-bin-win-cpu-x64.zip",
      "sha256": "282acb187e13a57f3190187bc7f632eacfd06eff3b705f472f905e6ee5154cbd",
      "sizeBytes": 18350156
    },
    {
      "id": "win-cpu-arm64",
      "os": "windows",
      "arch": "arm64",
      "backend": "cpu",
      "file": "llama-b10194-bin-win-cpu-arm64.zip",
      "sha256": "f0a8d60572a7911621fd3b10d5951524a4ddcffdc439155cb701453c002096aa",
      "sizeBytes": 12194228
    },
    {
      "id": "win-vulkan-x64",
      "os": "windows",
      "arch": "x64",
      "backend": "vulkan",
      "file": "llama-b10194-bin-win-vulkan-x64.zip",
      "sha256": "234f9f37d19d88d547b392eeb59a25a9a77d5b603f9e6c5c829229d2104cd843",
      "sizeBytes": 33637361
    },
    {
      "id": "win-cuda-12.4-x64",
      "os": "windows",
      "arch": "x64",
      "backend": "cuda124",
      "file": "llama-b10194-bin-win-cuda-12.4-x64.zip",
      "sha256": "edcf4d7cf78768c48722bc7b3ff9a68cd4a2a8a56147cca44715b1ca6e364673",
      "sizeBytes": 250987906,
      "companion": {
        "file": "cudart-llama-bin-win-cuda-12.4-x64.zip",
        "sha256": "8c79a9b226de4b3cacfd1f83d24f962d0773be79f1e7b75c6af4ded7e32ae1d6",
        "sizeBytes": 391443627
      }
    },
    {
      "id": "win-cuda-13.3-x64",
      "os": "windows",
      "arch": "x64",
      "backend": "cuda133",
      "file": "llama-b10194-bin-win-cuda-13.3-x64.zip",
      "sha256": "9e52cd9a3f9a6783e8e9902d4bb81854f13a9d36d624f0ddddbf66572fad325d",
      "sizeBytes": 146865373,
      "companion": {
        "file": "cudart-llama-bin-win-cuda-13.3-x64.zip",
        "sha256": "1462a050eb4c684921ba51dcc4cc488a036674c3e73e9945ee705b854808d03e",
        "sizeBytes": 390970417
      }
    },
    {
      "id": "ubuntu-x64",
      "os": "linux",
      "arch": "x64",
      "backend": "cpu",
      "file": "llama-b10194-bin-ubuntu-x64.tar.gz",
      "sha256": "1cad17fa8c34b1d3d660f8ff8c27be9abc8c109382f2042c8464a675f0da809b",
      "sizeBytes": 16430548
    },
    {
      "id": "ubuntu-arm64",
      "os": "linux",
      "arch": "arm64",
      "backend": "cpu",
      "file": "llama-b10194-bin-ubuntu-arm64.tar.gz",
      "sha256": "aeb42412e948156ab4d1e0e60895529fbe314d9e2949ff8dee17618d427fc7d4",
      "sizeBytes": 13330859
    },
    {
      "id": "ubuntu-vulkan-x64",
      "os": "linux",
      "arch": "x64",
      "backend": "vulkan",
      "file": "llama-b10194-bin-ubuntu-vulkan-x64.tar.gz",
      "sha256": "08dbf4af900e0dd0da139ae440a497768c0bc10301b673cc0b60d56d37b89a3d",
      "sizeBytes": 32413168
    },
    {
      "id": "ubuntu-vulkan-arm64",
      "os": "linux",
      "arch": "arm64",
      "backend": "vulkan",
      "file": "llama-b10194-bin-ubuntu-vulkan-arm64.tar.gz",
      "sha256": "44b45853ee28f9ed22e0284d424707b6db33a57f9b2439c5e7603825b21e065b",
      "sizeBytes": 26492296
    }
  ]
}
